,Tweet ID,Sentiment,Tweet Text,Tweet Label
222,1192912311415033857,neutral,Want to work at Cintas Corporation We re hiring in Anaheim CA Click for details cintasjobs,0
223,1192911724866756609,positive,This job might be a great fit for you Route Check in Coordinator cintasjobs Service,1
224,1192910506081673217,neutral,Cintas Corporation is hiring in Cambridge ON Click the link in our bio to apply Loader Unloader 2nd shift cintasjobs,0
225,1192910378029576192,positive,Cintas Corporation is hiring in Green Bay WI Read about our latest Labor job opening via the link in our bio Ga,1
226,1192909508080627712,positive,This job might be a great fit for you Route Service Sales Representative 4 Day Workweek cintasjobs,1
227,1192908443587186690,positive,Can you recommend anyone for this Utilities job in Kennesaw GA Click the link in our bio to see it and more Mai,1
228,1192908195099865088,positive,See our latest FortMyers FL job and click to apply Stockroom Utility Operator cintasjobs,1
229,1192908069421760512,neutral,We re hiring Click to apply Sales Representative Facility Services cintasjobs Sales,0
230,1192905673559855104,positive,Interested in a job in MadisonHeights MI This could be a great fit Click the link in our bio to apply Utility,1
231,1192904747860127744,neutral,Can you recommend anyone for this job in Denver CO cintasjobs,0
232,1192904078730203136,positive,We re hiring Read about our latest job opening here Management Trainee cintasjobs MgmtTrainee,1
233,1192903613640658946,positive,See our latest FortWorth TX job and click to apply Inventory Control Specialist cintasjobs,1
234,1192903276636672000,neutral,Career tip for landing jobs like Folder Garment Linen Bulk 2nd shift in Westland MI Go on informational in,0
235,1192902857483153408,positive,This job might be a great fit for you Fire Service Technician Alarm Systems cintasjobs,1
236,1192902731230351361,positive,We re hiring in Wichita KS Click the link in our bio to apply to this job and more Assistant Service Sales Repr,1
237,1192902690151387136,positive,Can you recommend anyone for this job New Account Coordinator cintasjobs,1
238,1192901936288169985,neutral,If you re looking for work in Indianapolis IN check out this Labor job via the link in our bio Production Wareh,0
239,1192901723167133696,positive,We re hiring in BatonRouge LA Click the link in our bio to apply to this job and more Route Service Sales Repre,1
240,1192901514160852993,positive,Join the Cintas Corporation team See our latest Production Hourly job openings including Garment Sorter via th,1
241,1192900964207845382,positive,Career tip for landing jobs like Soil Sling Operator in Gilroy CA Go on informational interviews The best way,1
242,1192899917309628417,positive,Interested in a job in Loader Unloader 2nd shift This could be a great fit cintasjobs,1
243,1192899587511480321,positive,Join the Cintas Corporation team See our latest job opening here Washroom Operator cintasjobs,1
244,1192898783891210240,positive,If jobs with titles like Mat Roller 3rd shift sound appealing to you follow us to hear about these types of op,1
245,1192897942358609920,positive,See our latest Calgary AB Canada Sales job opportunity and click the link in our bio to apply Sales Representati,1
246,1192896812761239552,positive,Join the Cintas Corporation team See our latest Utilities job openings including Maintenance Technician I 2nd,1
247,1192896557500129280,neutral,Want to work at Cintas Corporation We re hiring in Montgomery AL Click the link in our bio for details on this,0
248,1192896515632549888,neutral,This job is now open at Cintas Corporation in Erlanger KY Follow us and turn on mobile alerts to hear about jobs,0
249,1192896473194590209,positive,We re hiring Read about our latest job opening here Advanced Management Candidate cintasjobs Service,1
250,1192895804589170689,neutral,We re hiring Click to apply Utility III Operator 2nd Shift cintasjobs,0
251,1192895712947662848,neutral,If you re looking for work in Lima OH check out this Sales job via the link in our bio Route Service Sales Repr,0
252,1192895126206435328,positive,Cintas Corporation is looking for teammates like you See our latest Utilities job openings including Maintenanc,1
253,1192894877287084032,neutral,Cintas Corporation is hiring in Pawtucket RI Click the link in our bio to apply Fire Service Technician Sprinkler Systems cintasjobs,0
254,1192894672273756160,negative,Don t be shy Score a job like Maintenance Technician 3rd Shift at Cintas Corporation by asking for referrals,-1
255,1192893991433338880,positive,Cintas Corporation is hiring in Bedford VA Read about our latest Labor job opening via the link in our bio Wrapout Operator cintasjobs,1
256,1192893657948385280,positive,Cintas Corporation is hiring in Painesville OH Read about our latest Labor job opening via the link in our bio,1
257,1192893444105965569,positive,Cintas Corporation is looking for teammates like you See our latest Sales job openings including Accounts Recei,1
258,1192891303790383104,positive,Interested in a job in Greenville WI This could be a great fit Click the link in our bio to apply Utility III,1
259,1192891261595709441,positive,Stop staring at the clock every day It s time for a new career Follow us to view jobs with titles like Accounts,1
260,1192890170938249216,neutral,Can you recommend anyone for this job Folder Garment Linen Bulk cintasjobs,0
261,1192889286711885824,neutral,Want to work at Cintas Corporation We re hiring in TerreHaute IN Click the link in our bio for details on this,0
262,1192889246396239872,positive,Stop staring at the clock every day It s time for a new career Follow us to view jobs with titles like Stockroom,1
263,1192889161885220864,neutral,Nervous to apply for a job like Mat Roller at Cintas Corporation Apply even if you re not a 100 match You migh,0
264,1192888824017276928,neutral,Want to work at Cintas Corporation We re hiring in Jacksonville FL Click the link in our bio for details on thi,0
265,1192888066744041472,neutral,Want to work at Cintas Corporation We re hiring in Morgantown WV Click the link in our bio for details on this,0
266,1192887565369499648,neutral,Cintas Corporation is hiring in PleasantHill IA Click the link in our bio to apply Route Service Sales Represen,0
267,1192887523850080256,positive,We re hiring Read about our latest job opening here Service Supervisor cintasjobs Service,1
268,1192887269478166528,positive,Can you recommend anyone for this Labor job in Westbrook ME Click the link in our bio to see it and more Garmen,1
269,1192886934944665600,positive,Have you ever had a role like Sales Representative Facility Services What did you like most about that job cintasjobs Sales,1
270,1192886681101144064,positive,Career tip for landing jobs like Warehouse Specialist in Arlington TX Go on informational interviews The best,1
271,1192885510248660992,positive,If jobs with titles like Route Service Sales Representative 4 Day Workweek sound appealing to you follow us to,1
272,1192884860366442496,positive,We re hiring in KCMO MO Click the link in our bio to apply to this job and more Production Associate Washer,1
273,1192884147078885376,positive,Cintas Corporation is looking for teammates like you See our latest Labor job openings including Production As,1
274,1192881328733114369,neutral,Want to land a job like Sales Specialist Fire Protection at Cintas Corporation Applicant tracking systems look,0
275,1192880869200908288,neutral,Can you recommend anyone for this job Route Service Sales Representative cintasjobs,0
276,1192880617643397120,neutral,If you re looking for work in Olyphant PA check out this job Garment Processor cintasjobs,0
277,1192880574353965056,positive,Want to work in StCharles MO View our latest opening LINK CUSTOM HASHTAGS cintasjobs,1
278,1192879061472727041,neutral,Click the link in our bio to see currently open Service jobs like Management Trainee at Cintas Corporation in Cul,0
279,1192878096157827073,positive,See our latest Williston VT Sales job opportunity and click the link in our bio to apply Sales Representative U,1
280,1192876455564201985,positive,This job might be a great fit for you Loader Unloader 2nd shift cintasjobs,1
281,1192875786308472832,neutral,If you re looking for work in Reno NV check out this job Route Service Sales Representative Sanis 4 day Work,0
282,1192875450621554688,positive,This job might be a great fit for you Sales Representative Facility Services cintasjobs Sales,1
283,1192874482068672512,positive,We re hiring in Youngstown OH Click the link in our bio to apply to this job and more Service Sales Representati,1
284,1192873518142091265,positive,This Labor job might be a great fit for you Click the link in our bio to see it and more Production Associate L,1
285,1192871456104828929,positive,This BusinessMgmt job might be a great fit for you Click the link in our bio to see it and more Uniform Room Att,1
286,1192870490836103168,positive,Stop staring at the clock every day It s time for a new career Follow us to view jobs with titles like Deep Clea,1
287,1192869859907883008,neutral,Want to work at Cintas Corporation We re hiring in Frankfort IN Click the link in our bio for details on this j,0
288,1192868936917798913,neutral,Nervous to apply for a job like Route Check in Coordinator at Cintas Corporation Apply even if you re not a 100,0
289,1192868137298878464,positive,Interested in a job in Ontario CA This could be a great fit Click the link in our bio to apply Loader Unloader,1
290,1192868095603310592,neutral,Can you recommend anyone for this job Service Sales Representative Fire Protection cintasjobs,0
291,1192867969719648256,neutral,Looking to score a job at Cintas Corporation You re in luck Click the link in our bio for the job description and,0
292,1192867423013064704,positive,See our latest Harrisburg NC job and click to apply Service Sales Representative First Aid and Safety,1
293,1192866712107929600,positive,Want to work in Edmonton AB Canada View our latest opening LINK CUSTOM HASHTAGS cintasjobs Salesrep,1
294,1192866246972149760,neutral,This job is now open at Cintas Corporation in MenomoneeFalls WI Follow us and turn on mobile alerts to hear abou,0
295,1192865954813734913,positive,This job might be a great fit for you Utility III Operator 3rd Shift cintasjobs,1
296,1192864276957954049,neutral,Want to work at Cintas Corporation We re hiring in Laurel MD Click for details cintasjobs,0
297,1192863390596644864,positive,See our latest Indianapolis IN Sales job opportunity and click the link in our bio to apply Route Service Sales,1
298,1192863138246299648,positive,This Service job might be a great fit for you Click the link in our bio to see it and more Advanced Management C,1
299,1192861165149282305,positive,Interested in a job in Utility IV Operator This could be a great fit cintasjobs,1
